{
  "$schema": "http://json-schema.org/draft-07/schema#",
  "$id": "price-snapshot.schema.json",
  "title": "PriceSnapshot",
  "description": "An immutable, timestamped price capture — build1-spec.md §5. Never overwritten; a print references the exact snapshot it used.",
  "type": "object",
  "additionalProperties": false,
  "definitions": {
    "decimalString": {
      "type": "string",
      "pattern": "^-?[0-9]+(\\.[0-9]+)?$",
      "description": "A decimal number encoded as a string. Never a JSON number — no floats in money maths."
    }
  },
  "properties": {
    "snapshot_id": {
      "type": "string",
      "minLength": 1,
      "description": "Stable identifier a print's price_snapshot_ref points at."
    },
    "timestamp": {
      "type": "string",
      "pattern": "^\\d{4}-\\d{2}-\\d{2}T\\d{2}:\\d{2}:\\d{2}(\\.\\d+)?Z$",
      "description": "ISO 8601 UTC capture time."
    },
    "source": {
      "type": "string",
      "enum": ["openrouter", "litellm", "provider-page", "merged"],
      "description": "Per build1-spec.md §5: primary/secondary/verification sources. \"merged\" is per-entry: openrouter's own routed-market price where a registry entry is OpenRouter-routed, falling back to litellm's list price only for entries with no OpenRouter presence at all (a direct-provider frontier model) — never overriding an available openrouter price. Written once, alongside the two single-source snapshots, so an OpenRouter-only or LiteLLM-only reader still has a pure single-source file to work from; only the publish pipeline reads the merged one."
    },
    "entries": {
      "type": "array",
      "minItems": 1,
      "items": {
        "type": "object",
        "additionalProperties": false,
        "properties": {
          "model_id": {
            "type": "string",
            "minLength": 1
          },
          "price_in_usd_per_1m": { "$ref": "#/definitions/decimalString" },
          "price_out_usd_per_1m": { "$ref": "#/definitions/decimalString" },
          "price_cached_in_usd_per_1m": {
            "$ref": "#/definitions/decimalString",
            "description": "Rate for cached/reused prompt tokens (RunRecord.usage.cached_input), when the source publishes one separately from price_in_usd_per_1m — e.g. LiteLLM's cache_read_input_token_cost. Optional: absent for a source or model with no separately-published cache rate, in which case cached_input tokens go unpriced rather than priced at a guessed rate — see docs/methodology.md's cost-of-production section."
          },
          "subsidised": {
            "type": "boolean",
            "description": "true when this price is observed below the computed hardware floor — build1-spec.md §5's subsidised-supply policy. Included in the exchange-rate table but excluded from the headline reference set."
          }
        },
        "required": ["model_id", "price_in_usd_per_1m", "price_out_usd_per_1m"]
      }
    }
  },
  "required": ["snapshot_id", "timestamp", "source", "entries"]
}
